{
  "name": "intro_refined.md",
  "type": "doc/markdown",
  "path": ".ai-flow/runs/room-abc123/artifacts/intro_refined.md",
  "size": 1280,
  "sha256": "0123456789abcdef0123456789abcdef0123456789abcdef0123456789abcdef",
  "origin": { "room": "room-abc123", "entity": "E-AGENT-1", "port": "text.generate", "workspace": "room" },
  "version": 1,
  "ts": "2025-10-17T12:02:10Z",
  "metadata": { "note": "refinado com guidance=clareza" }
}
